{
  "schema_version": 1,
  "run_id": "e2e-codex-20260807-r2",
  "state": "needs_input",
  "version": 23,
  "last_seq": 23,
  "contract": {
    "schema_version": 1,
    "goal": "Independently inspect and verify the fixed E2E source fixture in two rounds.",
    "constraints": [
      "Do not modify the workspace.",
      "Use only the existing e2e-source.txt fixture.",
      "Return exactly the requested JSON contract without prose."
    ],
    "deliverables": [
      "Audited evidence for inspection and dependent verification."
    ],
    "acceptance_criteria": [
      "e2e-source.txt exists and its exact trimmed content is expert-team-e2e-v1.",
      "Both required work items receive independent accepted audits."
    ]
  },
  "work_items": {
    "inspect-source": {
      "schema_version": 1,
      "id": "inspect-source",
      "objective": "Read e2e-source.txt and report its exact trimmed content as evidence; make no changes.",
      "role": "software-engineer",
      "mode": "read",
      "required": true,
      "depends_on": [],
      "ownership": [],
      "evidence_required": [
        "Exact observed content and the inspected relative path."
      ],
      "executor_id": "executor-inspect-source-2-fa520e07",
      "attempt": 2,
      "status": "blocked"
    },
    "verify-source": {
      "schema_version": 1,
      "id": "verify-source",
      "objective": "Independently verify e2e-source.txt against the accepted dependency evidence; make no changes.",
      "role": "software-qa-engineer",
      "mode": "verify",
      "required": true,
      "depends_on": [
        "inspect-source"
      ],
      "ownership": [],
      "evidence_required": [
        "Exact content comparison and dependency consistency."
      ],
      "executor_id": null,
      "attempt": 0,
      "status": "pending"
    }
  },
  "verified_progress": {},
  "event_ids": [
    "b1e2869a-ed07-470b-85de-9c345598dc3b",
    "e5253be0-c38f-4919-854f-197d7263f4b9",
    "3304fced-b5f7-400f-9f44-138c57683757",
    "472321d3-c5e6-4423-96aa-ecda05fc42a2",
    "53e85078-6a31-4c5e-be23-28d741432767",
    "48f47f61-bb70-45f2-9f2d-606da26dabea",
    "56284d1b-3331-4996-b86f-261090d0414b",
    "abc5134f-44b9-4cae-9e17-82c177520973",
    "4db01840-cd84-4a4c-8eb4-376cf7c28eb7",
    "82c0ea97-9fd2-46db-805c-f38c4a04ac84",
    "c1677656-7f87-4b81-a7a0-fe0750e06487",
    "a8f7eb0c-0d98-4c17-90b7-0e8d2ac97d8e",
    "eac04a45-8961-47a1-9052-3002bc6e2c2c",
    "a3270cd8-43e4-499d-96b6-f61affda43b2",
    "7be0c583-4971-44d4-b9d2-7aaa952fcca1",
    "765915ad-6023-4457-bc7f-8612abb44e18",
    "15623973-fd8e-454d-8ee5-37e26b84ae15",
    "d0710b70-a7f1-4661-ab81-864ff7d0bf04",
    "1725e4a8-3942-41ab-bd28-af22addbe27d",
    "c8332b1a-d282-4d62-b092-649a527961a0",
    "882d8486-8a76-48f0-814f-abf3653dfe32",
    "503ae1f7-0ca5-4344-aae4-4b5482196218",
    "feab0152-7352-44d7-a81e-c67eeddc90f4"
  ],
  "pending_gate": "blocked",
  "rounds_used": 2,
  "max_rounds": 4,
  "retry_limit": 2
}
